,Latitude,Longitude,Name,X,Y
0,1.44058500109,103.800988001,ADMIRALTY MRT STATION,24402.1063,46918.1131
1,1.31643261166,103.882906045,ALJUNIED MRT STATION,33518.6049,33190.002
2,1.36993317524,103.849558131,ANG MO KIO MRT STATION,29807.2654,39105.772
3,1.34250117776,103.880177899,BARTLEY MRT STATION,33214.934,36072.5255
4,1.28187378849,103.859079765,BAYFRONT MRT STATION,30867.0093,29368.625
5,1.31259162908,103.940968762,BAYSHORE MRT STATION,39980.4472,32765.4888
6,1.34122317571,103.775794285,BEAUTY WORLD MRT STATION,21598.1665,35931.2359
7,1.32397996889,103.929984495,BEDOK MRT STATION,38757.952,34024.7048
8,1.33474211676,103.91797833,BEDOK NORTH MRT STATION,37421.7438,35214.6804
9,1.33660782981,103.932234624,BEDOK RESERVOIR MRT STATION,39008.3132,35421.0409
10,1.31688894033,103.949065273,BEDOK SOUTH MRT STATION,40881.4914,33240.7046
11,1.29891843393,103.850353762,BENCOOLEN MRT STATION,29895.8639,31253.3259
12,1.31367223254,103.862977987,BENDEMEER MRT STATION,31300.8084,32884.7382
13,1.35130868012,103.849154419,BISHAN MRT STATION,29762.3507,37046.3699
14,1.31933570911,103.861569454,BOON KENG MRT STATION,31144.045,33510.9746
15,1.3386040545,103.706064623,BOON LAY MRT STATION,13837.9827,35641.9191
16,1.3224880711,103.816013994,BOTANIC GARDENS MRT STATION,26074.1721,33859.5355
17,1.34010520725,103.846755921,BRADDELL MRT STATION,29495.4317,35807.5455
18,1.29686168653,103.850667372,BRAS BASAH MRT STATION,29930.7674,31025.9016
19,1.36367137584,103.833631645,BRIGHT HILL MRT STATION,28034.8406,38413.368
20,1.38287785815,103.893121565,BUANGKOK MRT STATION,34655.3132,40537.2069
21,1.3002646898,103.855614761,BUGIS MRT STATION,30481.3648,31402.1925
22,1.34903410858,103.749566764,BUKIT BATOK MRT STATION,18679.3541,36795.0141
23,1.33372888323,103.83068955,BUKIT BROWN MRT STATION,27707.4166,35102.4803
24,1.35861159108,103.751790911,BUKIT GOMBAK MRT STATION,18926.9127,37854.0359
25,1.37900211672,103.761535115,BUKIT PANJANG MRT STATION,20011.3981,40108.6838
26,1.30663450449,103.790709404,BUONA VISTA MRT STATION,23257.993,32106.5631
27,1.33767450804,103.839529821,CALDECOTT MRT STATION,28691.2451,35538.768
28,1.44324371648,103.829578144,CANBERRA MRT STATION,27583.748,47212.0753
29,1.36981544888,103.764439214,CASHEW MRT STATION,20334.5589,39092.8585
30,1.35747897469,103.98788357,CHANGI AIRPORT MRT STATION,45201.3204,37729.1934
31,1.28435957823,103.843426776,CHINATOWN MRT STATION,29124.9585,29643.4786
32,1.34235282087,103.732596738,CHINESE GARDEN MRT STATION,16790.7466,36056.3019
33,1.38536316535,103.74437078,CHOA CHU KANG MRT STATION,18101.2472,40812.1216
34,1.44056973088,103.801049284,CITIBANK ADMIRALTY SMRT STATION,24408.9261,46916.4245
35,1.31644118839,103.882964034,CITIBANK ALJUNIED SMRT STATION,33525.0585,33190.9505
36,1.36942855696,103.849455226,CITIBANK ANG MO KIO SMRT STATION,29795.8138,39049.9738
37,1.34279912514,103.879844248,CITIBANK BARTLEY SMRT STATION,33177.8016,36105.4703
38,1.32398184936,103.929953736,CITIBANK BEDOK SMRT STATION,38754.5289,34024.9126
39,1.35104746897,103.848150959,CITIBANK BISHAN MRT STATION,29650.6771,37017.4858
40,1.33845148864,103.705927087,CITIBANK BOON LAY SMRT STATION,13822.6755,35625.0499
41,1.32206594702,103.814871547,CITIBANK BOTANIC GARDENS SMRT STATION,25947.0287,33812.8601
42,1.34060469323,103.847230971,CITIBANK BRADDELL SMRT STATION,29548.2993,35862.7764
43,1.29663762907,103.85069342,CITIBANK BRAS BASAH SMRT STATION,29933.6665,31001.1265
44,1.30018223693,103.855832112,CITIBANK BUGIS SMRT STATION,30505.5541,31393.0755
45,1.3489920354,103.749555824,CITIBANK BUKIT BATOK SMRT STATION,18678.1364,36790.3619
46,1.35868355972,103.751906338,CITIBANK BUKIT GOMBAK SMRT STATION,18939.7587,37861.9934
47,1.30721824244,103.790317467,CITIBANK BUONA VISTA SMRT STATION,23214.3751,32171.1106
48,1.33763544123,103.839558681,CITIBANK CALDECOTT SMRT STATION,28694.4569,35534.4482
49,1.34224494825,103.732766602,CITIBANK CHINESE GARDEN SMRT STATION,16809.6501,36044.3731
50,1.3853351095,103.74435225,CITIBANK CHOA CHU KANG SMRT STATION,18099.185,40809.0194
51,1.29298990728,103.852542631,CITIBANK CITY HALL SMRT STATION,30139.4704,30597.7817
52,1.31522520299,103.765168552,CITIBANK CLEMENTI SMRT STATION,20415.5572,33056.5417
53,1.30244743428,103.798294974,CITIBANK COMMONWEALTH SMRT STATION,24102.1904,31643.5653
54,1.30865291404,103.889186755,CITIBANK DAKOTA SMRT STATION,34217.6066,32329.7774
55,1.29868872326,103.846122839,CITIBANK DHOBY GHAUT SMRT STATION,29425.0,31227.9229
56,1.31139153705,103.778656382,CITIBANK DOVER SMRT STATION,21916.6142,32632.5975
57,1.3197271575,103.903100261,CITIBANK EUNOS SMRT STATION,35766.0164,33554.35
58,1.33464531001,103.961602547,CITIBANK EXPO SMRT STATION,42276.6697,35204.1861
59,1.28267937001,103.781565993,CITIBANK HAW PAR VILLA SMRT STATION,22240.3616,29457.7459
60,1.31244727759,103.796800676,CITIBANK HOLLAND VILLAGE SMRT STATION,23935.9047,32749.2991
61,1.32767222441,103.678487958,CITIBANK JOO KOON SMRT STATION,10768.9092,34433.3054
62,1.33329506576,103.742153884,CITIBANK JURONG EAST SMRT STATION,17854.3175,35054.6987
63,1.31148732851,103.871347275,CITIBANK KALLANG SMRT STATION,32232.2338,32643.1553
64,1.3210355411,103.912952172,CITIBANK KEMBANGAN SMRT STATION,36862.4335,33699.0574
65,1.29389697291,103.784429608,CITIBANK KENT RIDGE SMRT STATION,22559.0823,30698.1247
66,1.4175890605,103.833061043,CITIBANK KHATIB SMRT STATION,27971.34,44375.3122
67,1.42506906281,103.76209945,CITIBANK KRANJI SMRT STATION,20074.3565,45202.5357
68,1.34410477497,103.720301862,CITIBANK LAKESIDE SMRT STATION,15422.4669,36250.0842
69,1.30742055156,103.862841588,CITIBANK LAVENDAR SMRT STATION,31285.6366,32193.4592
70,1.35161038613,103.864197519,CITIBANK LORONG CHUAN SMRT STATION,31436.478,37079.7471
71,1.27638264457,103.854620763,CITIBANK MARINA BAY SMRT STATION,30370.7638,28761.4381
72,1.43262603482,103.774051197,CITIBANK MARSILING SMRT STATION,21404.4326,46038.1104
73,1.34868319542,103.839320412,CITIBANK MARYMOUNT SMRT STATION,28667.9372,36756.0523
74,1.31257031718,103.838086793,CITIBANK NEWTON SMRT STATION,28530.6568,32762.875
75,1.32045851814,103.843840431,CITIBANK NOVENA SMRT STATION,29170.9782,33635.1137
76,1.29942133387,103.787189783,CITIBANK ONE-NORTH SMRT STATION,22866.277,31308.9745
77,1.30336399692,103.832267259,CITIBANK ORCHARD SMRT STATION,27882.9977,31744.887
78,1.28145413952,103.839078211,CITIBANK OUTRAM PARK SMRT STATION,28641.0,29322.2087
79,1.37300805043,103.949265084,CITIBANK PASIR RIS SMRT STATION,40903.4338,39446.0827
80,1.31810656951,103.893126033,CITIBANK PAYA LEBAR SMRT STATION,34655.9866,33375.1247
81,1.33755128796,103.696942417,CITIBANK PIONEER SMRT STATION,12822.7695,35525.5638
82,1.29447551922,103.806092574,CITIBANK QUEENSTOWN SMRT STATION,24969.9831,30762.0612
83,1.2839332621,103.851463067,CITIBANK RAFFLES PLACE SMRT STATION,30019.3314,29596.3437
84,1.28934817817,103.817043992,CITIBANK REDHILL SMRT STATION,26188.7768,30195.0958
85,1.44902668521,103.820139486,CITIBANK SEMBAWANG SMRT STATION,26533.3762,47851.5309
86,1.35064579504,103.872590477,CITIBANK SERANGOON SMRT STATION,32370.5216,36973.101
87,1.34298327326,103.953590039,CITIBANK SIMEI SMRT STATION,41384.9144,36126.1124
88,1.300170883,103.839412916,CITIBANK SOMERSET SMRT STATION,28678.245,31391.8097
89,1.3028306851,103.875358507,CITIBANK STADIUM SMRT STATION,32678.6621,31685.9551
90,1.33527910507,103.888295694,CITIBANK TAI SENG MRT STATION,34118.3746,35273.9641
91,1.35354742596,103.944958694,CITIBANK TAMPINES SMRT STATION,40424.2842,37294.1991
92,1.32729973605,103.946871852,CITIBANK TANAH MERAH SMRT STATION,40637.3319,34391.868
93,1.27659346907,103.845906621,CITIBANK TANJONG PAGAR SMRT STATION,29400.9489,28784.7436
94,1.27066358514,103.809832442,CITIBANK TELOK BLANGAH SMRT STATION,25386.1737,28129.0562
95,1.28607064302,103.827229824,CITIBANK TIONG BAHRU SMRT STATION,27322.3725,29832.6779
96,1.33296549741,103.847050347,CITIBANK TOA PAYOH HUB SMRT STATION,29528.2025,35018.0731
97,1.33262055411,103.847624633,CITIBANK TOA PAYOH SMRT STATION,29592.1148,34979.9314
98,1.43688030705,103.786463539,CITIBANK WOODLANDS SMRT STATION,22785.7494,46508.4946
99,1.39712886286,103.747329717,CITIBANK YEW TEE SMRT STATION,18430.5868,42113.1021
100,1.38188415819,103.844793732,CITIBANK YIO CHU KANG SMRT STATION,29277.0392,40427.2479
101,1.42951728654,103.835058274,CITIBANK YISHUN SMRT STATION,28193.6021,45694.2754
102,1.29293624285,103.852585892,CITY HALL MRT STATION,30144.2851,30591.8478
103,1.2883860242,103.846555209,CLARKE QUAY MRT STATION,29473.1249,30088.7038
104,1.31520126395,103.765182447,CLEMENTI MRT STATION,20417.1035,33053.8946
105,1.30250853671,103.798226128,COMMONWEALTH MRT STATION,24094.5286,31650.3218
106,1.30854798428,103.889064718,DAKOTA MRT STATION,34204.0253,32318.1745
107,1.29870130663,103.846115155,DHOBY GHAUT MRT STATION,29424.1448,31229.3143
108,1.31140529293,103.778637842,DOVER MRT STATION,21914.5509,32634.1186
109,1.27944619038,103.852840444,DOWNTOWN MRT STATION,30172.6259,29100.1876
110,1.2936577248,103.855081226,ESPLANADE MRT STATION,30421.9935,30671.6278
111,1.3198383468,103.903626852,EUNOS MRT STATION,35824.6205,33566.6464
112,1.33538213733,103.962375707,EXPO MRT STATION,42362.7103,35285.6654
113,1.31190557366,103.853477716,FARRER PARK MRT STATION,30243.5206,32689.3796
114,1.31743915137,103.807379214,FARRER ROAD MRT STATION,25113.2012,33301.2602
115,1.29247892792,103.84432827,FORT CANNING MRT STATION,29225.2834,30541.2748
116,1.27914567316,103.868024688,GARDENS BY THE BAY MRT STATION,31862.5102,29066.9758
117,1.32150583802,103.871900626,GEYLANG BAHRU MRT STATION,32293.7994,33750.9518
118,1.2938147349,103.833725122,GREAT WORLD MRT STATION,28045.2447,30688.9788
119,1.31950521494,103.660552957,GUL CIRCLE MRT STATION,8772.8553,33530.3675
120,1.26538938442,103.821530157,HARBOURFRONT MRT STATION,26688.0367,27545.8535
121,1.28257135831,103.781752725,HAW PAR VILLA MRT STATION,22261.1431,29445.8021
122,1.36234486762,103.767418254,HILLVIEW MRT STATION,20666.0675,38266.7898
123,1.31224029607,103.796399122,HOLLAND VILLAGE MRT STATION,23891.2152,32726.4128
124,1.37129229258,103.892380519,HOUGANG MRT STATION,34572.8759,39256.1312
125,1.30517138759,103.855295714,JALAN BESAR MRT STATION,30445.853,31944.7496
126,1.32771717309,103.678375144,JOO KOON MRT STATION,10756.3544,34438.2764
127,1.33315261989,103.742286544,JURONG EAST MRT STATION,17869.0806,35038.9472
128,1.33496730156,103.908459734,KAKI BUKIT MRT STATION,36362.4224,35239.5458
129,1.31148890964,103.871386541,KALLANG MRT STATION,32236.6038,32643.3302
130,1.29794790462,103.886080218,KATONG PARK MRT STATION,33871.9027,31146.0646
131,1.32103824885,103.912949388,KEMBANGAN MRT STATION,36862.1237,33699.3568
132,1.29353698614,103.784572367,KENT RIDGE MRT STATION,22574.9694,30658.3189
133,1.41738337015,103.832979909,KHATIB MRT STATION,27962.3109,44352.568
134,1.33566276202,103.783399114,KING ALBERT PARK MRT STATION,22444.4896,35316.375
135,1.36017917027,103.885064856,KOVAN MRT STATION,33758.7578,38027.2794
136,1.42508698033,103.762137459,KRANJI MRT STATION,20078.5865,45204.5168
137,1.27225417751,103.802631578,LABRADOR PARK MRT STATION,24584.775,28304.9441
138,1.3442592503,103.720949268,LAKESIDE MRT STATION,15494.5171,36267.162
139,1.30739187936,103.86278461,LAVENDER MRT STATION,31279.2955,32190.2887
140,1.38550657933,103.83574381,LENTOR MRT STATION,28269.8971,40827.7939
141,1.30680002531,103.849646967,LITTLE INDIA MRT STATION,29817.1982,32124.8312
142,1.35161217103,103.864151939,LORONG CHUAN MRT STATION,31431.4055,37079.9444
143,1.32615024251,103.889298596,MACPHERSON MRT STATION,34230.01,34264.5433
144,1.2763111438,103.854604976,MARINA BAY MRT STATION,30369.0069,28753.5319
145,1.27460411039,103.863461786,MARINA SOUTH MRT STATION,31354.7019,28564.7868
146,1.27102703618,103.862447516,MARINA SOUTH PIER MRT STATION,31241.826,28169.2511
147,1.30263014513,103.904961932,MARINE PARADE MRT STATION,35973.2564,31663.8547
148,1.30676267898,103.915232532,MARINE TERRACE MRT STATION,37116.267,32120.8443
149,1.43252114828,103.774074641,MARSILING MRT STATION,21407.0413,46026.5125
150,1.34870726302,103.839423133,MARYMOUNT MRT STATION,28679.3688,36758.7136
151,1.32687671471,103.883247509,MATTAR MRT STATION,33556.5834,34344.8585
152,1.28053158615,103.843847647,MAXWELL MRT STATION,29171.7997,29220.1992
153,1.3714631884,103.836567766,MAYFLOWER MRT STATION,28361.595,39274.9472
154,1.32851795368,103.834688254,MOUNT PLEASANT MRT STATION,28152.4308,34526.2823
155,1.30620190483,103.882528081,MOUNTBATTEN MRT STATION,33476.5634,32058.7418
156,1.30678307773,103.818967004,NAPIER MRT STATION,26402.8027,32122.9559
157,1.31232009956,103.8379853,NEWTON MRT STATION,28519.3616,32735.2072
158,1.29976683527,103.863637018,NICOLL HIGHWAY MRT STATION,31374.1708,31347.1516
159,1.32044079085,103.843825619,NOVENA MRT STATION,29169.3298,33633.1535
160,1.29975987859,103.787457508,ONE-NORTH MRT STATION,22896.0731,31346.4085
161,1.30242224794,103.823868523,ORCHARD BOULEVARD MRT STATION,26948.2945,31640.7552
162,1.30398101334,103.832241452,ORCHARD MRT STATION,27880.1256,31813.1135
163,1.27973970676,103.839513521,OUTRAM PARK MRT STATION,28689.4469,29132.6357
164,1.31644118839,103.882964034,OVERSEA-CHINESE BANKING CORPORATION LIMITED ALJUNIED MRT STATION,33525.0585,33190.9505
165,1.35089894174,103.848126363,OVERSEA-CHINESE BANKING CORPORATION LIMITED BISHAN MRT STATION,29647.9399,37001.0624
166,1.31994339212,103.861746337,OVERSEA-CHINESE BANKING CORPORATION LIMITED BOON KENG MRT STATION,31163.7296,33578.1693
167,1.33853090891,103.7059113,OVERSEA-CHINESE BANKING CORPORATION LIMITED BOON LAY MRT STATION,13820.9191,35633.8319
168,1.3489920354,103.749555824,OVERSEA-CHINESE BANKING CORPORATION LIMITED BUKIT BATOK MRT STATION,18678.1364,36790.3619
169,1.35866272161,103.751913321,OVERSEA-CHINESE BANKING CORPORATION LIMITED BUKIT GOMBAK MRT STATION,18940.5358,37859.6892
170,1.30726492996,103.790091155,OVERSEA-CHINESE BANKING CORPORATION LIMITED BUONA VISTA MRT STATION,23189.1888,32176.2735
171,1.28437623908,103.843494683,OVERSEA-CHINESE BANKING CORPORATION LIMITED CHINATOWN MRT STATION,29132.516,29645.3209
172,1.34224494825,103.732766602,OVERSEA-CHINESE BANKING CORPORATION LIMITED CHINESE GARDEN MRT STATION,16809.6501,36044.3731
173,1.38526363165,103.744383818,OVERSEA-CHINESE BANKING CORPORATION LIMITED CHOA CHU KANG MRT STATION,18102.6978,40801.1156
174,1.29298990728,103.852542631,OVERSEA-CHINESE BANKING CORPORATION LIMITED CITY HALL MRT STATION,30139.4704,30597.7817
175,1.30244743428,103.798294974,OVERSEA-CHINESE BANKING CORPORATION LIMITED COMMONWEALTH MRT STATION,24102.1904,31643.5653
176,1.30858822209,103.889148944,OVERSEA-CHINESE BANKING CORPORATION LIMITED DAKOTA MRT STATION,34213.3987,32322.624
177,1.29868872326,103.846122839,OVERSEA-CHINESE BANKING CORPORATION LIMITED DHOBBY GHAUTEXCHANGE DHOBBY GHAUT MRT STATION,29425.0,31227.9229
178,1.31139153705,103.778656382,OVERSEA-CHINESE BANKING CORPORATION LIMITED DOVER MRT STATION,21916.6142,32632.5975
179,1.3197271575,103.903100261,OVERSEA-CHINESE BANKING CORPORATION LIMITED EUNOS MRT STATION,35766.0164,33554.35
180,1.3489920354,103.749555824,OVERSEA-CHINESE BANKING CORPORATION LIMITED FAIRPRICE BUKIT BATOK MRT STATION,18678.1364,36790.3619
181,1.43262603482,103.774051197,OVERSEA-CHINESE BANKING CORPORATION LIMITED FAIRPRICE MARSILING MRT STATION,21404.4326,46038.1104
182,1.37079214921,103.892321657,OVERSEA-CHINESE BANKING CORPORATION LIMITED HOUGANG MRT STATION,34566.3266,39200.8277
183,1.3276860612,103.678345539,OVERSEA-CHINESE BANKING CORPORATION LIMITED JOO KOON MRT STATION,10753.0595,34434.8364
184,1.4175890605,103.833061043,OVERSEA-CHINESE BANKING CORPORATION LIMITED KHATIB MRT STATION,27971.34,44375.3122
185,1.36039772657,103.885544567,OVERSEA-CHINESE BANKING CORPORATION LIMITED KOVAN MRT STATION,33812.1435,38051.4474
186,1.42506906281,103.76209945,OVERSEA-CHINESE BANKING CORPORATION LIMITED KRANJI MRT STATION,20074.3565,45202.5357
187,1.34410477497,103.720301862,OVERSEA-CHINESE BANKING CORPORATION LIMITED LAKESIDE MRT STATION,15422.4669,36250.0842
188,1.30747789846,103.862898568,OVERSEA-CHINESE BANKING CORPORATION LIMITED LAVENDER MRT STATION,31291.9778,32199.8004
189,1.30728882449,103.849922419,OVERSEA-CHINESE BANKING CORPORATION LIMITED LITTLE INDIA MRT STATION,29847.8531,32178.8803
190,1.32571120545,103.890357906,OVERSEA-CHINESE BANKING CORPORATION LIMITED MACPHERSON MRT STATION,34347.9016,34215.9995
191,1.31263385423,103.838086793,OVERSEA-CHINESE BANKING CORPORATION LIMITED NEWTON MRT STATION,28530.6568,32769.9006
192,1.32045835535,103.843842646,OVERSEA-CHINESE BANKING CORPORATION LIMITED NOVENA MRT STATION,29171.2247,33635.0957
193,1.30361902234,103.832219322,OVERSEA-CHINESE BANKING CORPORATION LIMITED ORCHARD MRT STATION,27877.6627,31773.0864
194,1.37300805043,103.949265084,OVERSEA-CHINESE BANKING CORPORATION LIMITED PASIR RIS MRT STATION,40903.4338,39446.0827
195,1.31813649088,103.893143871,OVERSEA-CHINESE BANKING CORPORATION LIMITED PAYA LEBAR MRT STATION,34657.9717,33378.4333
196,1.33755106279,103.697315277,OVERSEA-CHINESE BANKING CORPORATION LIMITED PIONEER MRT STATION,12864.265,35525.5366
197,1.33187971406,103.869057878,OVERSEA-CHINESE BANKING CORPORATION LIMITED POTONG PASIR MRT STATION,31977.4131,34898.0373
198,1.4043978261,103.9020443,OVERSEA-CHINESE BANKING CORPORATION LIMITED PUNGGOL MRT STATION,35648.2314,42916.8045
199,1.29443406476,103.806158476,OVERSEA-CHINESE BANKING CORPORATION LIMITED QUEENSTOWN MRT STATION,24977.3174,30757.4773
200,1.2839332621,103.851463067,OVERSEA-CHINESE BANKING CORPORATION LIMITED RAFFLES PLACE MRT STATION,30019.3314,29596.3437
201,1.44902668521,103.820139486,OVERSEA-CHINESE BANKING CORPORATION LIMITED SEMBAWANG MRT STATION,26533.3762,47851.5309
202,1.39122186671,103.895302715,OVERSEA-CHINESE BANKING CORPORATION LIMITED SENGKANG MRT STATION,34898.0235,41459.8518
203,1.34975857779,103.873620995,OVERSEA-CHINESE BANKING CORPORATION LIMITED SERANGOON MRT STATION,32485.2083,36874.9989
204,1.34297370428,103.953551999,OVERSEA-CHINESE BANKING CORPORATION LIMITED SIMEI MRT STATION,41380.6811,36125.0541
205,1.3001401351,103.839575848,OVERSEA-CHINESE BANKING CORPORATION LIMITED SOMERSET MRT STATION,28696.3778,31388.4098
206,1.33514564172,103.88833611,OVERSEA-CHINESE BANKING CORPORATION LIMITED TAI SENG MRT STATION,34122.8728,35259.2065
207,1.35310122195,103.945281592,OVERSEA-CHINESE BANKING CORPORATION LIMITED TAMPINES MRT STATION,40460.2214,37244.8617
208,1.32701524291,103.946155932,OVERSEA-CHINESE BANKING CORPORATION LIMITED TANAH MERAH MRT STATION,40557.6585,34360.4065
209,1.27656829196,103.846006679,OVERSEA-CHINESE BANKING CORPORATION LIMITED TANJONG PAGAR MRT STATION,29412.0846,28781.9597
210,1.28612486475,103.827075902,OVERSEA-CHINESE BANKING CORPORATION LIMITED TIONG BAHRU MRT STATION,27305.2422,29838.6735
211,1.332596728,103.847577286,OVERSEA-CHINESE BANKING CORPORATION LIMITED TOA PAYOH MRT STATION,29586.8456,34977.2968
212,1.42958876565,103.835050382,OVERSEA-CHINESE BANKING CORPORATION LIMITED YISHUN MRT STATION,28192.7239,45702.1792
213,1.27621352269,103.791350313,PASIR PANJANG MRT STATION,23329.2647,28742.7658
214,1.37304321199,103.949284605,PASIR RIS MRT STATION,40905.6061,39449.9708
215,1.3172473855,103.892260754,PAYA LEBAR MRT STATION,34559.6917,33280.1182
216,1.3375868822,103.697321513,PIONEER MRT STATION,12864.9592,35529.4973
217,1.33137952462,103.869055665,POTONG PASIR MRT STATION,31977.1677,34842.7289
218,1.29289175425,103.8608918,PROMENADE MRT STATION,31068.6608,30586.937
219,1.40454672779,103.902072638,PUNGGOL MRT STATION,35651.3846,42933.2694
220,1.29455085173,103.806077156,QUEENSTOWN MRT STATION,24968.2673,30770.3911
221,1.28412561057,103.851461712,RAFFLES PLACE MRT STATION,30019.1805,29617.6126
222,1.28963453338,103.81674097,REDHILL MRT STATION,26155.0533,30226.7597
223,1.30385218548,103.852769429,ROCHOR MRT STATION,30164.7019,31798.8767
224,1.44905082123,103.820046141,SEMBAWANG MRT STATION,26522.9883,47854.1998
225,1.3916946261,103.895484694,SENGKANG MRT STATION,34918.274,41512.1277
226,1.35063361483,103.872771661,SERANGOON MRT STATION,32390.6853,36971.7545
227,1.27773021973,103.850405709,SHENTON WAY MRT STATION,29901.6608,28910.4425
228,1.30999484426,103.930297049,SIGLAP MRT STATION,38792.7964,32478.3007
229,1.34320289493,103.953371694,SIMEI MRT STATION,41360.6138,36150.3959
230,1.33085764535,103.796906839,SIXTH AVENUE MRT STATION,23947.7494,34785.0233
231,1.30025287693,103.839158337,SOMERSET MRT STATION,28649.9126,31400.8761
232,1.39757790701,103.817799543,SPRINGLEAF MRT STATION,26272.9393,42162.5857
233,1.30281246884,103.875337711,STADIUM MRT STATION,32676.3477,31683.9408
234,1.32006555791,103.826024402,STEVENS MRT STATION,27188.23,33591.6609
235,1.32039875927,103.957242034,SUNGEI BEDOK MRT STATION,41791.4682,33628.847
236,1.33510208536,103.888433013,TAI SENG MRT STATION,34133.6572,35254.3905
237,1.35619148304,103.954634463,TAMPINES EAST MRT STATION,41501.0749,37586.6178
238,1.35330153288,103.945144689,TAMPINES MRT STATION,40444.9846,37267.0104
239,1.3455153053,103.938436971,TAMPINES WEST MRT STATION,39698.5276,36406.0143
240,1.32555623509,103.807760305,TAN KAH KEE MRT STATION,25155.6221,34198.8053
241,1.32718713454,103.946346461,TANAH MERAH MRT STATION,40578.8616,34379.4144
242,1.2992544132,103.897377093,TANJONG KATONG MRT STATION,35129.1416,31290.5607
243,1.27660448672,103.845952195,TANJONG PAGAR MRT STATION,29406.0209,28785.9619
244,1.29721821836,103.873488357,TANJONG RHU MRT STATION,32470.5412,31065.3539
245,1.28206894778,103.848648781,TELOK AYER MRT STATION,29706.1259,29390.1954
246,1.27070647762,103.809761611,TELOK BLANGAH MRT STATION,25378.2908,28133.7991
247,1.32398844993,103.930032477,THE DEVELOPMENT BANK OF SINGAPORE LIMITED BEDOK MRT STATION,38763.2919,34025.6428
248,1.35070567664,103.848078927,THE DEVELOPMENT BANK OF SINGAPORE LIMITED BISHAN MRT STATION,29642.6609,36979.6921
249,1.29659947021,103.850706057,THE DEVELOPMENT BANK OF SINGAPORE LIMITED BRAS BASAH MRT STATION,29935.0729,30996.9071
250,1.30726492644,103.789888306,THE DEVELOPMENT BANK OF SINGAPORE LIMITED BUONA VISTA MRT STATION,23166.6136,32176.2735
251,1.28449571969,103.843607911,THE DEVELOPMENT BANK OF SINGAPORE LIMITED CHINATOWN MRT STATION,29145.1173,29658.5325
252,1.34224494825,103.732766602,THE DEVELOPMENT BANK OF SINGAPORE LIMITED CHINESE GARDENT MRT STATION,16809.6501,36044.3731
253,1.38532717007,103.744423272,THE DEVELOPMENT BANK OF SINGAPORE LIMITED CHOA CHU KANG MRT STATION,18107.0888,40808.1412
254,1.31522520299,103.765168552,THE DEVELOPMENT BANK OF SINGAPORE LIMITED CLEMENTI MRT STATION,20415.5572,33056.5417
255,1.30867036005,103.889109403,THE DEVELOPMENT BANK OF SINGAPORE LIMITED DAKOTA MRT STATION,34208.998,32331.7063
256,1.29309408591,103.855583934,THE DEVELOPMENT BANK OF SINGAPORE LIMITED ESPLANADE MRT STATION,30477.941,30609.304
257,1.32769436488,103.678085068,THE DEVELOPMENT BANK OF SINGAPORE LIMITED JOO KOON MRT STATION,10724.0717,34435.7564
258,1.34410477497,103.720301862,THE DEVELOPMENT BANK OF SINGAPORE LIMITED LAKESIDE MRT STATION,15422.4669,36250.0842
259,1.32583875802,103.890312834,THE DEVELOPMENT BANK OF SINGAPORE LIMITED MACPHERSON MRT STATION,34342.8853,34230.1035
260,1.43262603482,103.774051197,THE DEVELOPMENT BANK OF SINGAPORE LIMITED MARSILING MRT STATION,21404.4326,46038.1104
261,1.31260208558,103.838149922,THE DEVELOPMENT BANK OF SINGAPORE LIMITED NEWTON MRT STATION,28537.6824,32766.3878
262,1.32021100697,103.843656762,THE DEVELOPMENT BANK OF SINGAPORE LIMITED NOVENA MRT STATION,29150.5378,33607.7451
263,1.31719911982,103.892364882,THE DEVELOPMENT BANK OF SINGAPORE LIMITED PAYA LEBAR MRT STATION,34571.2803,33274.7815
264,1.33756383101,103.697631494,THE DEVELOPMENT BANK OF SINGAPORE LIMITED PIONEER MRT STATION,12899.4568,35526.9465
265,1.29307389591,103.861067236,THE DEVELOPMENT BANK OF SINGAPORE LIMITED PROMENADE MRT STATION,31088.1851,30607.0775
266,1.2839332621,103.851463067,THE DEVELOPMENT BANK OF SINGAPORE LIMITED RAFFLES PLACE MRT STATION,30019.3314,29596.3437
267,1.33533999297,103.888265446,THE DEVELOPMENT BANK OF SINGAPORE LIMITED TAI SENG MRT STATION,34115.0082,35280.6967
268,1.27660857418,103.846006679,THE DEVELOPMENT BANK OF SINGAPORE LIMITED TANJONG PAGAR MRT STATION,29412.0846,28786.4139
269,1.43683264678,103.786404347,THE DEVELOPMENT BANK OF SINGAPORE LIMITED WOODLANDS MRT STATION,22779.1621,46503.2247
270,1.28619457933,103.82699894,TIONG BAHRU MRT STATION,27296.677,29846.3822
271,1.33262898712,103.847501764,TOA PAYOH MRT STATION,29578.4408,34980.8638
272,1.32102655324,103.649075477,TUAS CRESCENT MRT STATION,7495.5309,33698.6818
273,1.34086609564,103.636985602,TUAS LINK MRT STATION,6150.2146,35892.5527
274,1.32998908905,103.639614056,TUAS WEST ROAD MRT STATION,6442.6401,34689.7988
275,1.3299746288,103.899226655,UBI MRT STATION,35334.8918,34687.4518
276,1.39169349203,103.895484395,UNITED OVERSEAS BANK LIMITED SENGKANG MRT STATION,34918.2407,41512.0023
277,1.34173748389,103.961471789,UPPER CHANGI MRT STATION,42262.0767,35988.4036
278,1.35441643373,103.832898468,UPPER THOMSON MRT STATION,27953.2465,37390.0037
279,1.43696824734,103.786462452,WOODLANDS MRT STATION,22785.6286,46518.2186
280,1.44746541049,103.786500735,WOODLANDS NORTH MRT STATION,22789.9128,47678.9425
281,1.42743341606,103.793244602,WOODLANDS SOUTH MRT STATION,23540.3601,45463.8903
282,1.33919004553,103.870818309,WOODLEIGH MRT STATION,32173.3186,35706.3794
283,1.32889914133,103.965218532,XILIN MRT STATION,42679.1259,34568.8238
284,1.39753501779,103.747405114,YEW TEE MRT STATION,18438.9791,42158.0124
285,1.38175604611,103.84494729,YIO CHU KANG MRT STATION,29294.1283,40413.082
286,1.42944308081,103.835005046,YISHUN MRT STATION,28187.6787,45686.0701
287,1.38799293427,103.905413992,BAKAU LRT STATION,36023.2878,41102.8445
288,1.38002223,103.772647371,BANGKIT LRT STATION,21248.0566,40221.4484
289,1.25129010168,103.817802341,BEACH LRT STATION,26273.1493,25986.8301
290,1.37792612944,103.763103024,BUKIT PANJANG LRT STATION,20185.8834,39989.7013
291,1.39627763134,103.893797181,CHENG LIM LRT STATION,34730.4628,42018.8886
